{
  "schema_version": 1,
  "generated_at": "2027-01-12T13:05:00Z",
  "season": "2026-2027",
  "through": "2027-01-12",
  "days": [
    [
      "2026-12-18",
      2,
      1,
      0,
      0
    ],
    [
      "2027-01-12",
      1,
      2,
      1,
      1
    ]
  ],
  "states": [
    [
      "IA",
      2,
      3,
      0,
      0
    ],
    [
      "IL",
      1,
      0,
      1,
      1
    ]
  ],
  "schools": 5,
  "districts": 2
}
